,0
336,quel enjeu strat site vitrine plan moir document excellent base travail daction moir enjeux strat site vitrine contenir plan taill permettre daction page
337,inclusion public atypique travail agir particularit ration avi partag certain membre ration galement connaître sous millennials personne rale bien rue technologie lui auto expressif confiant ouvert nouveau
338,tude march restauration rapide chiffre affaire fast foods connaître baisse sans dent selon estimation inse valeur baiss puis rebond partiel encore faible augmentation autre preuve effondrement activit depuis
339,comment entreprendre adapter elles culture pratique manag riale face travail travail facilite flexibilit solide quilibre travail famille tout duire impact mobilit bien travail sentir avantage mettre oeuvre pratique travail ensembl avant sembler faire vitesse
340,attractivit secteur grand distribution plan probl matiqu moir master plan taill aide moir porter attractivit secteur grand distribution concentr marketing sensoriel grand surface agir aider orientation moir finir probl matiqu baser
341,analyse offrir demande secteur restauration rapide gare parisien march hamburger concentr domin trois marque mcdonald quick entreprise repr sentir essentiel march poss dent tiers base restauration implantation centre urbain quartier affaire march
342,droit fiscal petit entreprise ricaine aide sous partie moir gle contenu convention fiscal franco ricain concerner ventuel conflit imposition avant voquer principe subsidiarit finir vement unitaire pouvoir bien comprendre diff rence entre deux diff rence faire tout diff rence situation lorsqu voqu qualification constitutionnel
343,actionnariat salari comme levier performance entreprise camerounais etude empirique aller axer tude enqu aliser terrain effet penser celui permettre appr hender contour analyse plus donner opportunit pondre tout question
344,efficacit nerg tiqu transition nerg tiqu industrie quel enjeu avenir nergie besoin tout jour partout besoin maison chauffer clairer ville besoin placer usine besoin faire fonctionner machine volution industriel amorc notamment
345,silience industrie luxe riode crise plan moir inattendu changement faire aucun doute crise conomiqu provoqu pand coronavirus touch tout secteur notamment secteur luxe concerne commerce grand marque luxe principe
346,etude marketing groupe korian groupe korian oeuvre secteur soin accompagnement personne pays europ seau couvrir donc service soin domicil soin infirmier domicile bien fonctionner groupe korian faire appel plusieurs outil marketing blueprint
347,gociation plan taill moir document constitue point part daction moir page sujet gociation
348,pacte menacer opportunit produire pargn pacte ponse conomie fran aise transformation profond conomie clarer bruno maire devoir notamment touraine plan action croissance transformation entreprise pacte vaste plan gouvernemental viser
349,bien travail introduction plan moir face monde travail constant volution plein mutation che emploi cadence travail afin responsabiliser tout salari entreprise devoir contin ment adapter optimiser strat outre question bien travail
350,transformation riqu secteur grand distribution introduction plan taill moir grand distribution caract rise structure fortement concurrentiel objectif capter liser client apparition hypermarch cela cinquante constituer symbole consommation masse quentation hypermarch baisse
351,digitalisation assurance levier majeur valuation risque crise sanitaire covid apparaître printemp bouscul quilibre totalit acteur tout domaine confinement restriction limitation social fermeture commerce dire essentiel tout confront
352,comptabilit entreprise comptabilit invention ancien devoir adapter exigence conomie moderne gestion entreprendre largisser cadr champ activit point technologie traitement information ritabl syst
353,analyse strat giqu financi liquide medical systems alms liquide medical systems fusion trois entreprise taema france marko mefar italie electrocare systems service ind sentir tout abord liquide medical systems taema partement liquide devenir
354,analyse financi renault alis analyse financi taill groupe renault riode cela tudi ratio relatif management performance orier autour compte sultat group puis ratios relatif utilisation actif relatif
355,quel impact exchange traded fund volatilit march exchange traded fund finir comme instrument financier changent direct dire temps directement march concern soumettre contr exerc autorit march financier devoir appliquer gle
356,tude samsung rarchisation organisationnel horizontal effet nouveau organisation pass cheler prise cision effet organisation division chacun sidente chacun sident rendre compte
357,digital augmente potentiel croissance banque tail nouveau technologie profond ment modifi habitude norme comportement soci aussi bien plan individuel collectif googl amazon facebook microsoft netflix uber bien autre entreprise fondamentalement chang mani dont individu
358,imenprop imenprop constitu personne party service diff rent donne division horizontal travail chaque service responsable adjoint veille salari sous autorit faire bien travail
359,impact marketing digital commerce derni assist volution soci radicalement transform habitude achat consommateur fortiori strat gie marketing marque entreprise nouveau ration appel ultra connect pouvoir aujourd
360,guide pratique formation bouch secteur logistique transport depuis quelque secteur logistique transport plein essor tendance semble inverser bien contraire effet mondialisation essor commerce ligne tourisme masse encore localisation production firme
361,analyse swot ecomiam ecomiam enseign propose uniquement produit surgel faire agir entreprise familial prendre forme durant dont social situ quimper premier ecomiam ouvrir provenir entrepreneur daniel sauvaget noter
362,gestion projet veloppement commercial armor naturea situ bretagne brest quelque tre innombrable ressource naturel armor naturea entreprise cialis conception fabrication cosm tique marin depuis plus transformation algue actif marin
363,marketing magnum marque magnum connaître travers enti globe semble impossible jamais leur produit allemagne enseigne langnese magnum inscrire comme leader march fran segment glac revenir
364,force porter intel pendant quelque temps samsung entreprise intel corporation reprendre statut meilleur fabricant puce lectronique marque ricaine faire effort consid rable reprendre couronne march lectroniqu celui repr sentir dignement
365,analyse swot carrefour publi histoire carrefour commencer lors rencontre entre marcel fournier propri taire grand magasin annecy jacques dennis defforey propri taire magasin gros alentours lagnieu premier magasin carrefour ouvrir plus tard
366,force porter kiabi depuis crise sanitaire secteur porter connaître profond perturbation devoir fermeture nombreux magasin pendant riode confinement certains ferm finitivement leur porte nombreux secteur activit quoi
367,force porter walmart walmart principal fabricant grand taillant tat unis image ainsi taille refl ter puissance fort notori terme client fournisseur walmart toujours certain pouvoir fort position fonction
368,etude march haut joaillerie publi march joaillerie bijouterie synonyme industrie fortement velopp agrandissement quasi conster tout particuli rement secteur fran agir branche exception sein joaillerie traditionnel effectu notamment petit artisan
369,analyse swot randstad randstadt entreprise international cialis travail temporaire rimair ressource humain sens plus large groupe fond venir cinquante existence succ randstadt poss sormais environ agence
370,savoir motiver quipe moignage personnel partir exemple dire celui auteur anonyme agir apprendre bien conner mieux piloter diriger quipe surtout bien savoir motiver collaborateur pouvoir servir exemple importe quel individu terme
371,analyse pestel cdiscount cdiscount site vente ligne marque jour charl depuis cess velopper part entreprise tait cialis vente disque occasion puis diversifi sormai
372,marketing tiktok application mobile tiktok devenir plus plus incontournable cemment fusion application karaok musica propuls rang deuxi application plus charg nombre utilisateurs cesse multiplier dominance jeune
373,analyse pestel walmart walmart kroger carrefour voici podium classement plus grand entreprise grand consommation mond malgr intensit concurrentiel existant sein march walmart maintenir position leader chiffre affaire surprenant entreprise ricain
374,management quipe commercial sujet tude contenir information relatif fonctionnement quipe commercial enjeu tant motiver personne sentir plus challeng premi question suivant comment finir management pratiqu onard descaut
375,marketing intel entreprise ricain intel fond gordon moore andrew grove robert noyce dont social trouve santa clara californie entreprise informatique connaître ordinateur portable bourse hong kong nasdaq preuve
376,analyse pestel intel fond robbert noyce cordon moore santa clara californie intel corporation multinational ricain class aujourd deuxi plus grand entreprise fabrication puce microprocesseur mondial terme chiffr affaire adul
377,analyse pestel jerry soci ricain producteur glac fond burlington deux ami cohen jerry greenfield donner enseigne entreprise veloppe premi franchise ouvrir lequel distribue produit tout comme
378,analyse swot cdiscount cdiscount site internet vente internet site deux famille charle social entreprise situ bordeaux entreprise diversifi proposer initialement vente occasion
379,analyse swot magnum magnum marque glac chocolat haut gamme marque tenir groupe unilever forme segment part enti vaste univers group erlando britannique magnum commercialise glace pot tonnet ainsi sous forme bouch
380,analyse swot kiabi march porter connaître profond transformation arriv digitalisation comme celui crise sanitaire lourd con quence ensemble secteur effet commerc lectroniqu devenir mani
381,analyse pestel soci sigle international business machine corporation multinational ricain tenir activit fabrication logiciel riel informatique fabrication produire service informatique marque ricaine
382,analyse pestel fedex fede entreprise international service messagerie dition cours derni marque leader mondial march connaître fort croissance terme performance financi falloir savoir agir entreprise transport
383,marketing automobile publi secteur automobile celui plus volu espac cent ensembl crise conomique financi impact domaine cesse transformer devenir toujours plus indispensable consommateur fran comme tranger
384,avantage communication traditionnel grand distribution centre commercial face digital entreprise emeraude cadre formation cole gestion commerce bourg bresse afin valider derni tude cursus alise moir objectif ponse probl matiqu mesure stage cursu
385,analyse pestel syst syst entreprise fran aise dont rungi gion parisien agir coop rativ achat cialis grand distribution actuellement dominique schoelcher sident depuis suite historique embl matiqu sident
386,analyse pestel microsoft microsoft corporation entreprise technologique multinational ricain fond avril bill gates paul allen dont objectif principal taire veloppement vente interpr teur basic soci altair devenir sous traitant
387,marketing paypal paypal entreprise ricain cialis communication moyen paiement solument tourn vers riqu nouveau technologie paypal ambition principal permettre paiement alis ligne sans carte bancaire curis grand
388,comment amplifier rentabilit pargne salarial tout trisant environnement faible croissance premier obstacle lors choix tude alternance trouver entreprise celui correspondre crit choix tude accepte aider mener bien projet agricole titre brunoy essonne positair titre dont fonction
389,analyse sinistre gestion risque analyse historique sinistre rappeler pays personne divers entit existence multiple menace souligne fragilit face tel pisode nonobstant apparent protection laisse supposer progr technologique
390,marketing linkedin linkedin seau professionnel jour tat uni vise mettre relation professionnel quatre coin monde ambition lien entre coll gue ancien coll gue potentiel candidat recruteurs renforcer velopper
391,analyse swot airbnb publi airbnb fond lorsque fondateur brian chesky gebbia alis pouvoir gagner rapidement argent louer matelas pneumatique salon personne visiter francisco grand conf rence ensuite volu vers site
392,marketing nike publi afin faire face nombreux concurrent sent sein industrie quipement chaussure sport nike utilise marketing permettre renforcer capacit fense entreprise nike concurrence plusieurs entreprise industrie ailleurs
393,force porter microsoft microsoft multinational ricain oeuvrer domaine informatique fond bill gates paul allen effet microsoft corporation velopp vendre plusieurs produit tel syst exploitation logiciel soci souvent reconnaître
394,comment liorer visibilit entreprise internet publi plupart entreprendre trouver difficult booster visibilit marquer leur concurrent cela entreprise pouvoir monter strat digital engager prospects encore publier contenu attrayant optimi ailleurs plusieurs option astuce
395,pacte actionnaire publi lors ation nouveau firme start important prendre compte nombreux document juridique organisationnel devoir labor afin prot rennit entreprise pacte actionnaire faire alors partie document essentiel
396,analyse swot abercrombie fitch fond david thomas abercrombie ezra hasbrouck fitch abercrombie fitch entreprise ricain cialis vente tail tement accessoire social situ ohio cible principalement adolescent jeune adulte
397,segmentation marketing produit nestl branche produit laitier entreprise nestl tenir patronyme fondateur henri nestl multinational suisse social tabli nord vevey depuis origine entreprise nestl composer grand entreprise ainsi anglo suisse
398,marketing alors march mondial technologie information entreprise faire face concurrence roce fait devoir relever certains surpasser obstacle important conqu part march croissance revenir travers
399,nespresso analyse strat communication marque nespresso bien connaître grand public aujourd firme plus prosp derni propose produit utilis proportion croissant nage quotidien agir grand firme construire putation tenace
400,analyse pestel paypal paypal entreprise ricain cialis communication syst paiement objectif principal entreprise fournir moyen paiement alternatif carte bancaire fiable curi paiement alis ligne syst paypal
401,analyse pestel publi histoire commencer lorsque schueller jeune chimiste alsacien chement dipl institut chimie appliqu pari pose brevet proc teinture cheveu baptis deux plus tard fondre soci fran aise teinture
402,force porter heineken heineken groupe origin erlandaise cialis boisson envergure international groupe deuxi brasseur monde fond rard heineken poursuivre ensuite croissance stable organis abord europe
403,analyse swot pfizer entreprise pfizer fond tats unis deux immigrant allemand charles pfizer cousin charles erhart premier produit entreprise contre vers intestinau caramel comp tence pfizer tant chimiste formation
404,marketing heineken heineken deuxi brasseur monde matir taille entreprise chiffre affaire agir groupe mondial grand envergure origine erlandais group jour rard heineken heineken tenir environ part march chelle
405,marketing jerry jerry marque ricain commercialise sorbet glac sous forme pot carton fond cours jerry greenfield cohen nom retrouve marque premi boutique glace jerry
406,dossier gociation achat nouveau produit innovant march auchan montivillier vouloir aborder ce nouveau apporter nouveau gamme produire afin attirer nouveau client dynamiser vente direction ainsi service achat donc ress divers produit parmi glace black
407,comment construire business plan tape crucial lancement firme celui laboration business plan savoir document servir support senter source projet entrepreneurial crit principal tenant aboutissant afin parvenir alisation
408,marketing ebay derni secteur commerce content velopper plus encore livr concurrence rude commerce tail deux derni cennier commerce ligne conner succ industrie velopp lien direct
409,analyse swot audi fusion trois marque automobile allemand horch wanderer conglom faire appeler auto union repr sentir quatre anneau symboliser union entre constructeur sein groupe partition che faire segment audi voir
410,force porter emirate emirate compagnie rienn compter parmi plus connu plus important monde principal situ dubai mirat arabe unis emirate fond faire premi compagnie historique moyen orient principal
411,analyse swot jerry jerry marque ricain commercialise sorbet glac sous forme pot carton fond cours jerry greenfield cohen nom retrouve marque premi boutique glace jerry
412,gestion petit projet recrutement personnel probl pose parfois association incomp tence personne travailler projet autre association putation cause caract lucratif volontaire chercher employer personne
413,exemple contrat travail termin animateur rural texte dessous celui exemple contrat travail termin animateur rural entre employeur association veloppement organisation gouvernemental reconnaître minist riel janvier repr sentir
414,comment entreprise social pouvoir inspirer busines models capitaliste pondre enjeu social selon food agriculture organization million personne souffrir sous alimentation monde tandis plus milliard produit comestible chaque million hectare truit forestation
415,diagnostic mobilit cadre expert france sein direction ral ration rienne question entreprise france celui rencontre grave difficult conomique malgr instauration mesure efficace cours derni afin inverser ce tendance entreprise veloppe plan sauvegard emploi mobilit
416,marketing twitter twitter signifier litt ralement gazouillis anglais twitter seau social service microblogage dire utilisateurs pouvoir bloguer biais message court appel tweet princip twitter simple utilisateur pouvoir simplement
417,marketing nokia fond fredrik idestam mechelin nokia corporation soci finlandais nokia multinational oeuvrer secteur communication devenir premi fois leader fabrication phone mobile soci conserv
418,con quence pratique nouveau technologie changer donn informati mission expert comptable publi mani ral signe chang donn lectronique faire aliser transmission structur donn entre organisation entreprendre utiliser thode lectronique proc permettre chang fichier documentaire
419,chine bord faillite immobilier evergrand vouloir rassurant promoteur immobilier chinois croule sous dette plus milliard dollar
420,fret ferroviaire ligne rungis perpignan rouvrir octobre selon minist transport ce ligne inscrire cadre plan gouvernemental milliard euro veloppement fret ferroviaire
421,bretagne coop masque brade stock tenter viter bilan grand difficult financi soci coop rativ breton devoir couler stock million masque retrouver sorerie
422,fran estimer avoir perdre pouvoir achat emmanuel macron selon sondage fran juger galement gativ action conomiqu emmanuel macron depuis sultat sondage opinionway square
423,rouen carrefour teste abonnement destination client abonnement mensuel euro permettre obtenir duction lection produire
424,inquiet hausse prix lectricit aller adapter raconter nergie gouvernement pouvoir suffire compenser hausse
425,location encadrement loyer devoir sormais mentionn annonce immobili selon enqu publi janvier association consommateur clcv annonce logement pari taier conforme
426,droit litige notaire jouer aussi diateur afin sengorger tribunal particulier plus plus incit recourir diateur litige
427,australie fran alstom fournir train melbourn million euro constructeur fran fournir train banlieue construire place compo moins rial local
428,universal music bourse vivendi pare joyau coup financier bollor vivendi pare mondial production musical introduire bourse
429,emploi pourquoi cadre seniors valeur ajout entreprise rimer expert senior repr sentir part important cadre france peiner souvent retrouver emploi lorsqu devoir changer entreprise
430,seine maritime bloque sortie carburant site totalenergie affirme aucun produit sortir raffinerie depuis mardi
431,comment former riqu mettre tiers riqu relancer conomie
432,nice nice azur pingl agence fran aise anticorruption mediapart consulter dernier rapport organism rest confidentiel
433,assurance mage gouvernement ussir imposer forme allocation octobre syndicat venir aller nouveau attaquer texte justice
434,travailleur pendant artisan coin essentiel falloir avoir conscience selon jean christophe repon patrimoine personnel assurance mage sident emmanuel macron sentir ce semaine plan pendant lequel revenir jean christophe repon
435,veloppement fulgurer eurofins petit labo nantais devenir entreprise lanc nante entreprise familial eurofin devenir leader bioanalyse faire entr vendredi
436,immobilier payer quoi lors achat logement entre ventuel interm diaire document obligatoire payant transaction immobili entrer nombreux frais
437,sncf emmanuel macron sentir anniversaire savoir quel annonce compte faire sident voiler maquette grandeur nature moteur futur
438,chine tout comprendre isme provoqu immobilier evergrand deux expert pays pencher minute con quence possible difficult financi groupe
