,0
101,nouveau plan cacher neptune tude ricain semble confirmer astronome soup onnent depuis longtemps neuvi plan pouvoir tourner orbite autour soleil encore plus loin neptun
102,nasa surveille dirigeant vers terre baptis objet environ trois fois plus grand statue libert passage plan repr sentir cependant aucun danger
103,premier touriste espace retour terre quatre premier touriste spatial space amerrir samedi soir atlantique large florid avoir pass trois jour espace couronnant succ premi mission orbital histoire comport aucun astronaute professionnel bord suspendre quatre grand parachute capsule crew dragon space douceur heure conclure voyage heure trois minute
104,premier touriste space espace quatre touriste spatial ricain mercredi incroyable voyage apesanteur vaisseau space devoir passer trois jour orbite autour terre sans aucun astronaute professionnel bord premi historique
105,premier touriste spatial space quatre humain jamais espace auparavant pouvoir passer trois jour seul orbite autour terre tant entrer quelque mois lanc space dont premi mission tourisme spatial devoir coller mercredi soir
106,entreprise ricaine vouloir redonner mammouth laineux mammouth laineux teinte foulent nouveau arctique tente relever aide technique manipulation tiqu entreprise ricaine colossal lanc lundi
107,comment nement entre inconscier collectif septembre personne dont belge patrice braut quatre attaque simultan taier tats unis nement fortement marqu point appartenir sormais moir collectif selon olivier luminet professeur psychologi motion uclouvain
108,dragon volant jurassique identifi premi fois misph quipe scientifique chilien identifi premi fois servir atacama reste fossile dragon volant dinosaur jurassique taire auparavant identifi misph nord annonc vendredi universit chili
109,comment soleil pouvoir provoquer apocalypse internet selon tude ricain puissant temp solaire pouvoir provoquer pann mondial internet durant plusieurs semaine voire plusieurs mois provoquer ainsi apocalypse toil
110,rover nasa mars premier chantillon roche agence spatial ricaine confirm rover perseverance ussi lever premier chantillon roche mars
111,impressionnant aper bretagne observ ouest france bretagne normandie dimanche septembre avant minuit visible jusqu angleterre
112,soir pizza bord samedi taire soir pizza terre quipag station spatial international partag twitter spationaut fran thomas pesquet montre membre quipag train composer propre pizza essayer cher certain ingr dient flotter
113,vaisseau spatial virgin galactic clou incident agence ricain aviation indiqu jeudi vaisseau virgin galactic pouvoir revoler avant conclusion enqu incident survenir lors juillet transport milliardaire richard branson fondateur entreprise quelque minute espace
114,humain rire comme grand singe comme grand singe humain rigoler beaucoup inspiration avant voluer vers rire adulte plus expiratoire plus communicatif selon tude
115,bact contre surpoids couvrir belgiqu bier march bact contre surpoids couvrir spin uclouvain bient mettre march rapporte echo jeudi
116,scientifique couvrir extr nord plan cours dition juillet groupe scientifique couvrir pense terre merg plus septentrional monde nord groenland annonc universit copenhague
117,hors commun quatre patte couvert gypt scientifique apprendre davantage volution baleine fragment amphibiou phiomicetu anubi couvert oasi fayoum caire sahara occidental vivre probablement environ million
118,couvrir squelette vieux groupe humain encore inconnu arch ologue couvert squelette vieux chasseur cueilleur indon provenir groupe humain encore jamais identifi ailleurs selon article publi journal nature
119,tortue traque croque oisillon chercheur seychelle film tortue ant traquer tuer oisillon premi relat york time
120,nouveau sortie espace deux astronaute chinois deux astronaute chinois effectu vendredi nouveau sortie espace afin terminer montage bras articul tiangong station chinois construction indiqu agence spatial charg vol habit
121,nasa recrute quatre volontaire simuler mars pendant nasa recrute agence spatial ricain recherche quatre volontaire participer pendant trois mission test simulation mars indique communiqu publi dernier programm nomm chapeer crew health performance exploration analog parer mieux dition futur femme homme plan rouge
122,voici couvrir majeur nasa sujet bennu bennu passer terre seulement moiti distance parer plan lune clar nasa mercredi lant nouveau donn selon lequel chance impact rieur rester infime
123,quel con quence effondrement gulf stream climatologue tect signe effondrement gulf stream syst courant atlantique relay diff rent dia international dont guardian semaine pass disparition con quence catastrophique chelle mondial
124,millier objet arch ologique danger inondation comment sauver intemp rie frapp belgiqu mois juillet seulement impact particulier caves centre conservation tude agencer wallon patrimoine awap entrepo dizaine millier arch ologique inond deux reprise moins jour bon partie patrimoine wallon ainsi prendre boue depuis agent vole entam ritabl course contre montre contre ment sauver ventilateur parfois simple papier essuyer tout voici comment rent restaurer cieux objet travers cle
125,explosion toil captur tail premi fois premi tape supernova moment toile explose ndlr captur tail premi fois supernova porte trouve plus milliard lumi terre
126,machu picchu plus vieux penser selon nouveau tude publi revue antiquity machu picchu occup alentour plusieurs cennie plus penser
127,bolide agorier solar team solar challenge agorier solar team sentir lundi nouveau voiture solaire baptis bluepoint atla africamuseum tervuren mesure contre coronavirus chant solar challenge tenir australie lieu maroc
128,module scientifique russe nauka amarr presque retard boire technique nouveau module scientifique russe nauka amarr succ jeudi station spatial international annonc agence spatial russe roscosmos
129,plus vieux forme animal sans doute couvrir canada structure fossile similaire ponger couvrir nord ouest canada vivre million pouvoir rester plus ancien forme animal connaître terre selon tude publi mercredi
130,signe vital terre affaiblir selon scientifique signe vital plan affaiblir sous coup conomie mondial garde mercredi scientifique premier plan inqui tant imminence possible certain point ruptur climatique
131,jeff bezos offrir ristourne milliard dollar nasa alunisseur milliardaire jeff bezos propri taire soci spatial blue origin propos lundi nasa duction milliard dollar laisser entreprise construire syst alunissage
132,oiseau vieux million couvert argentin ontologue argentin annonc jeudi couvrir plus fossili oiseal historique lors travail campus universitaire province neuqu patagonie
133,nicolas gentil italien vivre comme hobbit chaque lundi courrier international invite couvrir influenceus influenceur ce semaine nicolas gentil chef tissier italien rendre parmi grand passionn seigneur anneau tolkien souhaite aujourd construire village hobbit abruzzer
134,tudiante marocain utiliser tiktok comme choppe ligne plein crise sanitaire petit commerce artisan inventer seau maroc tiktok particuli rement adapt gagner visibilit moignage trois tudiante termin
135,nouveau profession chin sosie star seau social chine jeune femme profiter ressemblance acteur notamment populaire bingbing mener partenariat marque seau exposer ainsi poursuite judiciaire
136,espagne quitte fonction amour romanci rotique sign faire plus jeune espagne xavier novell missionn raison strictement personnel religieux controver faire trouv amour aupr crivaine litt rature rotiqu connotation satanique
137,kenya jeune dipl diger dissertation tudiant mond entier quelque clic virement tudiant anglophone pouvoir octroyer service nyan professionnel dissertation diger devoir place raconte combine faire merger ritabl industrie kenyer jeunesse duqu heurte manqu perspective march emploi
138,hattuta nouveau voyageur arabe chaque lundi courrier international invite couvrir influenceus influenceur ce semaine hattuta vrai kasem hato glob trotteur jordanien faire couvrir monde million abonn seau social travers voyage comme sens
139,jordanie jean chir discorde interdire vision parce porter pantalon laisser voir genou basketteus jordanien soutien membre famill royal affaire suscit vif action conservateur seau social royaum
140,bon affaire youtubeur beast chaque lundi courrier international invite couvrir influenceus influenceur ce semaine jimmy donaldson ricain connaître sous pseudo beast pouvoir bier devenir youtubeur plus suivre monde alternent absurde philathropi spectacle hors champ homm affaire tendre
141,attirer baby boomer vert allemand reprendre chant plein campagne lectoral parti cologist allemand adapt chanson traditionnel land ration duction surprenant efficace selon spiegel clip pouvoir convaincre frange plus population
142,syrie tube tourn noir chanson weel weely groupe syrien safar faire carton rythme lancoliqu entrer nant surtout clip clin nurie lectricit
143,cunhaporanga partager tiktok tradition indig amazonie chaque lundi courrier international invite couvrir influenceus influenceur ce semaine gomez plus connaître sous cunhaporanga raconte tiktok depuis amazonie tradition mode indien tatuyo
144,afrique vengeance chanson loue whatsapp pouse tromp ritier employ reconnaisser diaspora mozambicain afrique loue service musicien venger demander justice plus rarement envoyer remerciement chanson crite mesur ensuite partag application messagerie whatsapp raconte site rest world
145,punchdown pologn ce puissance international gifle hebdomadaire polityker observe inqui tude engouement jeune internaute polonais punchdown nouveau sport consister gifler jusqu
146,clip bella poarch passer star tiktok star tout court espace deux chanson bella poarch transcend statut influenceus tiktok devenir nouveau star musiqu ricain clip rien succ estime hebdomadaire variety
147,ouvrir londres poulet frit client tablissement ouvrir porte mercredi possibilit faire livrer poulet room service appuyer bouton rapporte independent
148,theodore papakostas grec rendre arch ologie viral chaque lundi courrier international invite couvrir influenceus influenceur ce semaine theodore papakostas suivre plus abonn arch ologue partager instagram couvert histoire flexion discipline humour rision
149,diable libert schwarzenegger tance antivaccins lors interview direct acteur gouverneur californie arnold schwarzenegger abrutir antivaccins antimasques alors covid continuer augmenter appeler ricain faire confiance scientifique faire vacciner continuer respecter geste barri
150,propulser grand bretagne haut tableau daille olympique neuf breloque dont cinq athl britannique nomm contribuer grandement bel moisson pays former nation olympique part enti groupe comp titeurs occuper place classement daille devant italie amuse times
151,visite guid plan image court plique film danse voire simple geste infinit genres alors quel leur point commun finir tour horizon contenir ligne particulier issu suppl ment courrier ado
152,fidji but sitant membre opposition twitter tikoduadua partir ration national partir opposition fidji chement barqu twitter gagn nombreux internaute appr cier effort comprendre plateforme code parenth bienvenue alors archipel pacifique agir vif tension politique
153,mehmet aydin madoff turc visage poupon poursuivre justice turc recherch interpol fondateur application investissement agricole farm bank extrad vers istanbul juillet depuis tait enfuir accus avoir soutir million dollar syst ponzi
154,blacktiktokstrike mouvement volte danseur noir hashtag blacktiktokstrike danseur noir militer meilleur reconnaissance visibilit leur contenu tiktok noncent nouveau forme appropriation culturel nombre leur chor graphie reprendre influenceur blanc correctement leur
155,hotzo rire faire rire sant chaque lundi courrier international invite couvrir influenceus influenceur ce semaine sebastian holz hotzo jeune allemand devenir humoriste twitter instagram
156,grossesse binaire poign main tout couleur menu nouveau moji futur motic valid consortium unicod voil occasion journ mondial moji samedi juillet chaque pictogramme sormais disponible version genr inclusif
157,ramon abbas instagrameur luxe fortune suspect chaque lundi courrier international invite couvrir influenceus influenceur ce semaine ramon abba connaître sous pseudonyme hushpuppi rian afficher fastueux seau social derni duba soup avoir tourn centaine million dollar escroquerie ligne
158,caraca violent affrontement entre bande lourdement police police lienne tente tant bien reprendre contr certain quartier capital bande affronter depuis deux jour compense aller jusqu dollar promettre quiconqu participer arrestation principal responsable
159,campagne heineken vaccin retourne contre brasseur deuxi brasseur monde lanc jeudi juillet publicit ligne brer joie social vaccin contre covid lendemain twitter internaute contents appeler boycott marque
160,architecture forme emoji caca nouveau dimbourg hotel encore ouvert porte dimbourg suscite habitant volute acier coiffe conf silhouette rago tant
161,promotion vaccination france allemagne deux salle deux ambiance comparaison campagne promotion vaccination france allemagne confirm beaucoup allemand image fantasm fran peuple temp ramer combien ardent
162,loterie national mexiqu maison chapo gagner propri narcotrafiquant fonctionnaire corrompre quisitionn restitu peuple occasion loterie national organis septembre prochain parmi lot maison appartenir joaqu chapo guzm loge stade aztecer mexico acquérir gouvernement
163,traverser pays ligne droite aventure rectiligne davier chaque lundi courrier international invite couvrir influenceus influenceur ce semaine davier youtubeur britannique lanc curieux consister traverser pays entier ligne droite importer obstacle rencontr chemin
164,plus euro supporter allemand attaqu faire allemagne contre angleterre juin dernier jeune allemand apparaître grand cran pleur bra depuis victime commentaire haineux internet venir supporter anglais montrer autre image royaum britannique lever cagnotte honneur
165,fuite pipelin mexiqu faire agir fenseurs environnement incendie impressionnant fuite gazoduc sous marin appartenir compagnie troli pemex clar golfe mexiqu juillet greenpeac xico greta thunberg remettre cause exploitation nergie fossile pointer doigt leader monde
166,luca loutenbach supporter suisse devenir favori euro match france suisse lundi juin limination france euro trouv symbole supporter joie particuli rement monstrative tablo suisse blick rencontre jurassien dont visage faire tour
167,irene nonay pharmacienn navarr devenir agro influenceus chaque lundi courrier international invite couvrir influenceus influenceur ce semaine irene nonay jeune pharmacienn reconvertir agriculteur reprendre ferme familial nord espagne depuis quelque mois partager quotidien champ amandier seau social
168,laboratoir trouve aucun trace thon sandwich thon subway engag york times chercheur californien cialis analyse poisson chou certifier nature thon contenu sandwich restauration rapide lorsque poisson lang mayonnaise identification compliqu approvisionnement
169,cheval course plus consanguin habsbourg sang plus plus consanguin alerte economist alors riode monte continue hebdomadaire britannique inqui percussion animal croire entre cousin depuis ration
170,gypte chasse fille tiktok autre influenceuse soucieux sauvegarder lui consid rer comme bon autorit gyptienne sormai jeune fille star seau social collimateur lui frapper fort
171,australie personne vacu prison cause invasion souris centre correctionnel wellington contraindre vacuer tenir membre personnel cause invasion souris raconte australie lutte contre prolif ration rongeur occasionn million dollar
172,kang partager youtube rience fugi nord chaque lundi courrier international invite couvrir influenceus influenceur ce semaine kang signe adaptation ussi instar jeune femme certains fugi nord youtube raconter aussi parfois mieux faire conner pays origine
173,japon statue ant esse masqu jusqu pand aizuwakamatsu fecture fukushima statue ant esse ricorde arbore sormais masqu protection contre covid symbol rester jusqu crise sanitaire sous contr pays
174,chert essence liban ministre atteindre summum insolence cence approche canisme soutenir prix carburant liban tarif pompe pouvoir multipli cinq face ce situation ministre charg dossier raymond ghajar montr impuisser moins
175,euro entrer nement insolite doine nord alors doine nord affronte ukraine jeudi juin image film pendant entrer nement quipe donienne intrigu internaute pouvoir voir joueur chauffer mani inhabituel utiliser plot renver
176,prendre viagra sarcasm ministre irakien face famille nombreux remarque ministre irakien culture adress neuf enfant grand difficult financi illustre daraj dont autorit traiter question augmentation population pair celui pauvret
177,jeff bezos pouvoir acheter joconde manger taire vendre tition improbable devenir viral seau social ce semaine clame jeff bezo amazon premi fortune mondial plus portrait onard vinci manger question pleuvoir budget selon magazine ricain vice
178,twitter langue arabe accorde sormais minin utilisateur seau social sormai possibilit configurer plateforme choisir arabe forme minin initiative largement salu
179,moment plus saugrenu bill blasio maire york poste depuis maire york quitter fonction mois novembre sept construire putation papa blagueur compil prestation plus farfelu
180,eileen smith doyenn instagram chaque lundi courrier international invite couvrir influenceus influenceur ce semaine eileen smith ce retrait irlandais affiche tenue impeccable instagram attirer popularit inattendu coanime sormais mission mod
181,vendeur sauveter lancer marque chaussure barcelone mantero devoir surnom couverture lequel sentir leur produit souvent contrefer grand marque rue capital catalan syndicat populaire vendeur ambulant voil faire niqu nike lancer collection thiqu durable
182,incroyable famille kardashian termin sager continue incroyable famille kardashian poque certainement empire kardashian jenner quotidien famille propuls membre rang superc brit dont moindre tail taient cran bien avant live instagram tiktok
183,caler kilo coca retrouv plage promeneur couvrir jeudi kilo coca plage entre ambleteus gris calai cargaison probablement largu trafiquant gendarme continuer effectuer patrouille cher curieux ventuel autre pain drogu
184,mayenn accident coll gien bless dont deux grave laval accident faire nbsp jeudi matin bless dont deux grave nbsp transport pital nbsp transporter personne enfant adulte taire conducteur nbsp centaine sapeur pompier mobilis ce intervention
185,toulouse victime violent agression lieu rencontre toulousain agress lieu rencontre nuit samedi dimanche homm souffrir traumatisme facial tait toujours hospitalis lundi
186,benalla face justice reproch collaborateur macron alexandre benalla comparer partir lundi septembre devant nbsp tribunal correctionnel pari violence commettre marge nbsp image charg mission elys frapper manifestant place contrescarpe nbsp entrer scandale politique nbsp
187,crash licopt curit civil mort quatre bles licopt cras alors rendre ration commune villard lan canicien appareil annonc ministre rieur rald darmanin rendre place lundi septembre cause accident encore connaître nbsp nbsp
188,viol mineur producteur rard louvin mari nouveau enqu nouveau enqu quot viol mineur quot ouvrir contre producteur vision rard louvin mari daniel moyne enqu depuis janvier indiqu samedi parquet pari confirmer information parisien
189,fusillade marseille deux homme deux affaire distinct nuit mardi mercredi deux homme balle marseille centre ville second quartier nord deux fusillade selon source polici drame suppl mentaire lendemain agression policier exercice
190,accidentel alpinist espagnol mont blanc alpinist espagnol mort mardi avoir viss accidentellement alors venir atteindre sommet mont blanc choir tres nbsp
191,pari deux homme interpell braquage bijouterie place vendre vers midi nbsp nbsp policier inform braquage cours placer vendre pari nbsp selon premier ment enqu agir voiture trois personne deux scooter ensuite prendre chasse nbsp policier faire usage arme bles jambe homm interpell tandis deuxi nbsp homm interpell parking forum halle
192,dealer expul municipalit nice justifier cision famille venir expuls nice bailleur fils condamn trafic drogu nbsp ce cision ramener quot tranquillit quot quartier comme explique lundi europe anthony borr nbsp premier adjoint maire ville
193,nice expuls logement condamnation fil deal inform expulsion logement social nic fils condamn nbsp mois prison contr stup fiant cision dire prise bailleur venir ce condamnation fecture autre proc dur genre actuellement cours ville nbsp
194,figure narco banditisme marseillais interpell seine marne figure narco banditisme marseillais karim meziani interpell seine marne homme taire point deal plus important quartier nord marseille rald darmanin licit arrestation nbsp fugitif plus recherch france quot
195,estell mouzin interruption nouveau campagne fouille ardenne septi campagne fouille depuis lundi ardenne tenter retrouver corps fillette disparaître interrompre vendredi nbsp moniqu olivier veuve tueur michel fourniret mise examen complicit taire sentir lors partie recherche
196,proc attentat novembre ussi avancer quot kamikazer quot stade france terrasse bar salle bataclan mitraill attentat djihadiste nbsp novembre justice replonger partir septembre neuf mois horreur crime masse pari malgr souvenir bien sentir attaque habitant ussi avancer
197,train marchandise attaqu plein jour braquage spectaculaire proximit gare riom train fret attaqu mardi plein trajet voleur mont toit avant actionner syst depuis rieur rober marchandise judice faible train transporter petit mobilier coration nbsp
198,disparition estell mouzin nouveau fouille buter sence moniqu olivier nouveau fouille rechercher corps estell mouzin victime tueur michel nbsp fourniret devoir avoir lieu ardenne partir indiqu lundi source proche enqu lui rouler sence moniqu olivier compagne complice tueur nbsp
199,pari homme glise arrondissement glise parisien situ arrondissement capital signal homm police dimanche matin suspect tait venir faire souhaiter revenir messe heure policier finalement homme paroisse nbsp
200,royaume footballeur fran benjamin mendy accu viol plac tention provisoire justice britannique plac vendredi tention provisoire fenseur international fran manchester city benjamin nbsp mendy fenseur international fran accus quatre viol agression sexuel domicile prestbury cheshir
201,angleterre footballeur fran benjamin mendy accu viol agression sexuel accu quatre viol agression sexuel international fran manchester city benjamin mendy quot plac tention provisoire attente sentation devant tribunal chester quot annoncer police local fenseur suspendre club temps enqu nbsp
202,bles balle police stain parquet bobigny ouvrir information judiciaire parquet bobigny ouvrir ce semaine information judiciaire quot violence volontaire arme personn positair autorit public quot intervention deux policier brigade anti criminalit stain nuit deux membre hicule blesser vement deux personne nbsp
203,explosion toulouse comment site reconstruire catastrophe faire millier bles personne ancien crat reste zone vierge usine laiss place centre recherche cancer central photovolta nbsp
204,taire temps guerre toulouse impossible oubli catastrophe ville toulouse comm more mardi catastrophe explosion usine personne faire bless certain victime sentir encore quel physique pauline miranda confi micro europe
205,bastien rescap bataclan chapp plusieurs fois mort nuit novembre bastien taire fosse bataclan assister concert eagle death metal prendre otage djihadiste pendant plus deux heure sortir indemne physiquement attentat proc novembre permettre remettre ordre souvenirs moignage micro gwladys laffitt europe nbsp
206,moment oublier commissaire raconte enqu novembre proc novembre faire lumi ce nuit horreur pari enqu tentaculaire suivre rience marquant enqu teur pist terroriste europe entre reconner avoir quot habit quot ce riode
207,harki sident macron courage reconner responsabilit france sident emmanuel macron membre association harki annonc quot paration quot lundi europe mohand hamoumou sident association ajir france salue ce initiative quot prendre harki valoir tout sident sauf celui quot affirm
208,pozzz application aide jeune crocher phon harc lement enfant subir depuis rentr signe addiction jeune public phone portable donc seau social application baptis quot pozzz quot permettre parent limiter utilisation enfant syst compense
209,vendre vouloir utiliser eau produire potable vendre gestionnaire public veolia associ lancer projet traitement eal fin domestique transformer eau potable limiter nurie chauffement climatique nbsp
210,covid falloir assouplir restriction gion plus pargn alors situation miqu liore gouvernement pouvoir assouplir restriction certain territoire particuli rement pargn virus souher certains parmi lequel fabien bazin sident conseil partemental demande europe cutif quot regarder alit sanitaire terrain quot nbsp
211,mobilisation chasseur ritabl monstration force selon manifestant millier chasseur mobilis samedi septembre fendre chasse traditionnel oiseau gale conseil etat taient moins amien maximilien carlier rendre europe fier quot monstration force quot manifestant faire savoir cheraient rien sept mois sidentielle nbsp
212,journ sans voiture pari avant futur zone trafic limit pied trottinette roller surtout voiture dimanche septembre ville pari organis septi con cutiv journ sans voiture heure heure nbsp objectif parer parisien mettre place zone trafic limit second semestre nbsp
