,0
0,arbre anthropophage tout fauxquelque annes plus tard journal current literature rvl canular lech arbre exister poque public friand rcits explorateur livingston brazza marqu esprit souligne jean buard docteur science information science quest larbre anthropophage rsquo arbre anthropophage appeared first intresse curiosit continu
1,flash curiosit fourmi plus rapide monde dcouverte plante habitable tude nouveau site archologiqu encore photo potentiel ovni rdaction intresse propose brves curieux dveloppe deux minute ligne science flash curiosite flash curiosit appeared first intresse curiosit continu
2,voir vraiment filer avant mourir dcouvrez passer quand mourir cliquer iciselon chercheur certains visualiser quelque scne pass tandis autre impression revoir intgralement point varier aussi entre sensation revivre moment science voir vraiment defiler avant mourir voir vraiment dfiler avant mourir appeared first intresse curiosit continu
3,grand myst matir noir salon table canap quelque fauteuil tlvision bref quantit dnombrabl objet pouvoir numrer imaginer instant dise ralit salon remplir fatras objet divers milieu duquel canap science grand mystere matiere noir grand mystre matire noir appeared first intresse curiosit continu
4,quoi constitu empreindre digital matire mlange sueur sbum acide lactique acide amin protine minral recouvrir crte peau doigt paume mains plante pied quelque jour plusieurs annesselon surface lisse poreux condition con science quoi constituees empreindre digital quoi constitue empreinte digital appeared first intresse curiosit continu
5,pouvoir utiliser smartphone temps orage principe fonctionnement smartphone augmente risque frapp foudre mission radio unsmartphon incapable attirer guider foudre vers leur source mission taire antenne relai utiliser type onde science pouvoir utiliser smartphone temps dorage pouvoir utiliser smartphone temps rsquo orage appeared first intresse curiosit continu
6,aveugle voir noir contrairement pouvoir penser ccit plonger forcment nuire monochrome certain aveugle dcrivent vision nuance gris autre couleur diffrente chaque variable selon motion fatigue autre encore voir scintillement science aveugle voir noir aveugle voir noir appeared first intresse curiosit continu
7,bact rie devoir apparaître quelque milliard anne bactrie leur lointain cousin arche temps coloniser tout milieu aujourd micro organisme partout trouve enfouis driver lac rivire flottant science bacterie devoir bactries devoir appeared first intresse curiosit continu
8,flash curiosit fourmi plus rapide monde dcouverte plante habitable tude nouveau site archologiqu encore photo potentiel ovni rdaction intresse propose brves curieux dveloppe deux minute ligne science flash curiosite flash curiosit appeared first intresse curiosit continu
9,tourisme spatial quand plaisir quelque polluer plan tout roland lehoucq commissariat nergie atomique nergie alternatif emmanuell universit pari saclay franoi graner universit parisen septembre milliardaire japonais yusaku maezawa achet elon musk service systme starship entreprise spac science tourisme spatial quand plaisir quelque polluer planete tout tourisme spatial quand lesplaisir dequelque polluer plantedetous appeared first intresse curiosit continu
10,antarctique trou couche ozone passer taille continent essentiel terr situe stratosphr couche ozone agir comme bouclier protg tre vivant rayon ultraviolet produit soleil depuis anne scientifique dcouvert ce couche appauvrir science antarctique trou couche dozon depass deja taille continent antarctique trou couche rsquo ozone dper taille continent appeared first intresse curiosit continu
11,sommeil paradoxal contrario rythme respiratoire pouls augmenter lectrncphalogramme rvlerait ailleurs activit crbral comble aussi intensmer voire plus pendant veil pourtant dormir quel troisime fonctionnement science quest sommeil paradoxal rsquo sommeil paradoxal appeared first intresse curiosit continu
12,pourquoi homme endormir avoir faire amour apr clin femme gnralement forme prolonger moment intimit diffremment leur compagnon surtout besoin rcuprer aussi exasprant ce situation pouvoir plus normal physiologiquement comme souvent lorsque organis science pourquoi homme sendorment apres avoir faire lamour pourquoi homme rsquo endormir aprs avoir faire rsquo amour appeared first intresse curiosit continu
13,flash curiosit fourmi plus rapide monde dcouverte plante habitable tude nouveau site archologiqu encore photo potentiel ovni rdaction intresse propose brves curieux dveloppe deux minute ligne science flash curiosite flash curiosit appeared first intresse curiosit continu
14,transport solvez casse participant souffrir transport entrans quinze minute quotidiennement pendant quatorze jour raliser exercice habilet visuospatial mettre preuve capacit cerveau reprsenter espace deux trois dimension comment chercher science transport resolvez cass tet transports rsolvez casser appeared first intresse curiosit continu
15,chinois evergrand menac faillite march mondial plomb spectr lehman chinois peur contagion crise immobilier chinois evergrand stresser march mondial lundi confront doute concerner perspectif croissance inflation
16,epargner pension voici quelque formule fiscalement avantageux belge craindre ficier pension complet diane tout pension salari janvier taire euro brut savoir exactement combien ver avenir ainsi tout personne souhaite conserver marge uvre financi suffisant retraite devoir constituer petit compl mentir pendant carri professionnel possibilit manquer lui souvent assortir incitation fiscal dessou guide epargne formule fiscalement avantageux contexte
17,deux ation vendre neuf deux paysage audiovisuel francophone information mettre vente
18,possible ressant contracter hypoth cair ligne depuis plusieurs banque digitalisent rapidement sormais pouvoir facilement gler aide banque ligne application mobile service lesquel devoir rendre agence bancaire autrefois exception ce hypoth cair lequel devoir encore rendre agence bancaire toutefois certain banque permettre gler immobilier enti rement ligne guid epargne explique quoi devoir tenir compte
19,duire horeca octobre duire horeca expirer comme mois septembre annonc ministre finance vincent peteghem dimanche zevend
20,petra sutter vouloir tendre automatiser tarif social internet comme nergie ministre ral communication petra sutter groen vouloir tendre automatiser tarif social abonn internet confier samedi nieuwsblad
21,changer assureur auto pouvoir rapporter argent beaucoup entre rester assureur auto pendant recevoir chaque compte prime payer nouveau assur ressant porte monnaie quand valoir mieux passer autre assurance auto independer approfondir ce question
22,salon auto bien lieu dition salon auto brussel motorshow rouler janvier palais brussel expo annoncer vendredi febiac ration automobile cycle plus ce semaine plusieurs dia indiqu avenir nement taire menac raison cision ieteren participer
23,mediamarkt annoncer fermeture trois magasin septembre mediamarkt fermer trois magasin septembre annoncer faire gation syndical lors conseil entreprise extraordinaire vendredi heure indique belga
24,thomas katrien vivre habitat group cision jamais regrett plus sept quatre famille ainsi unir leur moyen acheter maison passablement labr taire molir reconstruire plusieurs habitation placer thomas katrien quatri dernier couple rejoindre projet cision jamais regrett jetter coup maison site construction livios
25,nouveau travail imminent autoroute charleroi nouveau viation travail foisonner charleroi compris seau routier autoroutier nouveau chantier buter vendredi soir cela nouveau percussion circulation automobile
26,davantage entreprise prendre flagrant abus mage temporaire fraude mage temporaire augment depuis crise coronavirus selon chiffre office national emploi onem rapport journal morgen vendredi entreprise ainsi prendre flagrant abus
27,expertise obligatoire obtenir hypoth cair banque devoir faire expertiser bien avant octroyer hypoth cair montant calcul fonction valeur expertise plus prix achat signaler ce semaine libre belgique echo leur colonne
28,postnl devant justice esclavage moderne coursier tribunal correctionnel maline entamer vendredi important proc contre soci colis postnl ainsi sous traitant poursuivre fraude social organis coursier comme principal victime forme moderne esclavage selon syndicat tien
29,vers batibouw covid saf ticket brussel expo dition salon batibouw passer mode virtuel dernier raison pand coronavirus prendre place vrier sein palais brussel expo jouir jeudi organisateur fisa
30,tudiant rendre cole voiture combien moment venir prendre chemin universit loger encore chez papa maman toutefois rejoindre campus transport public mince affaire petit citadin alors solution vers quel aller pleuvoir voiture plus polluant bien pleuvoir hicule cologiqu flambant neuf quel terme meilleur option portefeuill independer faire comparaison
31,exces profit rulings bien gime aide cour justice union europ enn confirm rendre jeudi syst belge exon ration fice dentaire firme belge multinational exces profit ruling constituer gime aide comme soutenir commission europ enn
32,boom offre emploi forem depuis ce chiffre forem diffus offre emploi rapport augmentation selon chiffre forem publi jeudi titre sudpresse
33,bleeker falloir aliser effort budg taire milliard secr taire etat budget bleeker open estime falloir aliser effort budg taire suppl mentair voquer montant milliards euro mettre mesure soutien corona raison reprendre croissance entretien publi jeudi journal soir
34,vivendi vincent bollor annoncer projet groupe lagard dia vivendi contr vincent bollor annonc mercredi compter acqu participation fonds amber capital groupe lagard intention poser projet acqu solde groupe propri taire hachette europe
35,proposition partir faire face flamb prix nergie plusieurs partenaire coalition vivaldi parti opposition formul dernier jour propositions faire face augmentation prix nergie dernier date propose syst provisoire cliquet
36,comment obtenir pension plus croyez pouvoir encore mener confortable retraite selon dernier chiffre barom financi assureur faire partie minorit seulement belges croire toutefois disposer quelque option obtenir encore montant valoir peine dessou guide epargne donne quelque tuyau contexte
37,travailleur belge accumul plus jour vacance accoutum travailleur belge prendre ce moins vacance entre janvier lors normal ressort mercredi chiffre prestataire service ressource humain acerta base donn travailleur cela risque entrainer difficult employeur terme arrangement plan vacance leur employ
38,crise nage belge pens plus nourriture boisson tabac nage belge consacr dernier budget produit alimentaire boisson tabac contre effet crise coronavirus diff rent confinement impos population plus grand partie budget ailleurs logement loyer nergie entretien autre frais ressortir nouveau chiffre statbel office belge statistique tablis base enqu aupr nage
39,alternative brique voici option prix autre chose brique faire connaissance parement ger conf rer aspect unique maison permettre simultan ment grer paisse couche isolation combinaison parfait novation comme nouveau construction site construction livios donne aper rial ter parfaitement exercice
40,avenir salon auto tenir plus rideau menacer tomber finitivement salon auto selon plusieurs dia group importateur ieteren participer plus nement group stellanti fusionner peugeot fiat opel citro devoir prendre mercredi cision crucial avenir salon
41,comment expliquer flamb prix nergie prix lectricit march gros connaître hausse vertigineux chelle europ enn premier impact faire ressentir facture consommateur risque nurie hiver plan comment expliquer ce flamb prix moins exceptionnel
42,unizo demande derni prolongation mesure soutien entreprise union entrepreneur flamand unizo plaid mardi trois jour prochain comit concertation prolongation durant encore trimestre mesure soutien entreprise tel mage temporaire droit passerell pendant compter encore moins perte chiffre affaire mesure vue jusqu septembre
43,deux prison comptable tourn euro fgtb vervier ancien comptable travaill pendant central ral fgtb vervier condamn lundi tribunal correctionnel vervier deux prison sursis trois avoir tourn important argent indiqu justice vervi tois
44,europe face flamb prix nergie prix naturel march gros plus jamais criver lundi echo tijd
45,servation obligatoire rendre calanque sugiton partir servation obligatoire rendre certain calanque marseille afin viter affluence server lieu instant seul calanque sugiton concern taire bien trop quer pic personne jour sident parc national calanque didier ault tait direct bfmtv expliquer image bfmtv mosmzuuduhkcricn uvhrpw image reservation obligatoire rendre calanque sugiton
46,urbain malgr risque adept moigne ce passion sauvage runs multiplier france quartier campagne source nuisance voisinag parfois accident grave comme glisy juillet dernier spectateur mourir percut deux roue adepte parler passion style bike life aimer exemple piste pouvoir exercer passion juan palencia paire rencontr entre image bfmtv hbpsue aeyh qkmiyky image rodeo urbain malgr risque adept temoigne ce passion
47,explosion certain victime revivre encore apocalypse septembre trouver proximit usine toulouse quand explos outre quel physique certain victime devoir vivre image tragique auxquelles lui confront jour image bfmtv kjxwuhr ijgpm image cratere provoque explosion usine chimique toulouse octobre
48,jolhiter aide soignant origine tenir naturalis compense engagement lutte contre covid travailleur origine trang premi ligne pendant crise sanitaire naturali compense engagement lutte contre covid plus france notamment jolhiter aide soignant ehpad origine tenir image bfmtv vxlzv qbqjathcgqcvr image travailleur origine etranger premier ligne pendant crise sanitaire naturaliser
49,vingt toulouse comm more explosion meurtrir explosion meurtrir usine caus mourir personne parcours moriel divise victime voil occasion comm moration accident image bfmtv ildvi pfkxok hpfio image plaque commemorativ
50,explosion usine toulousain raconter comment catastrophe septembre usine exploser toulouse faire mort millier bles jour plus grand catastrophe industriel survenir france depuis image bfmtv yznqfaoj zxhkpkzzqawvw image apres explosion usine toulousain raconter comment vecu catastrophe
51,rouen statue napol bier remplac celui halimi maire ville vouloir boulonner statue napol remplacer autre repr sentant halimi image bfmtv peab roww image rouen statue napoleon bientot remplacee celui gisele halimi
52,hicule outil indispensable hausse prix carburant difficile assumer infirmier maire altorf rhin hausse prix carburant impact budget nage fran surtout personne dont voiture ment essentiel afin travailler notamment bruno infirmier maire altorf rhin image bfmtv dshb rmdgn idtli image vehicule outil indispensable hausse prix carburant difficile assumer infirmier liberal maire altorf rhin
53,serge carel attendre france reconnaître officiellement responsabilit abandon massacre harki serge carel ancien harki juillet tait plateau bfmtv revenir claration sident public effet lors hommage lundi emmanuel macron demand pardon harki france annonc projet reconnaissance paration gard rien combattre fran aise image bfmtv mbkb xhyeoadl grwtfb image serge carel attendre france reconnaître officiellement responsabilite abandon massacre harki
54,serge carel sident macron comprendre probl harki serge carel ancien harki juillet assur bfmtv lundi soir sident macron compris probl harki image bfmtv iopesj otpx ppjgyq image serge carel president macron comprendre probleme harki
55,anti blanquer promettre franchir cran nouveau contre cyberharc lement ministre ducation placement lundi coll oise appel sursaut fraternit campagne harc lement subir seau social sixi image bfmtv jrunixp ioyqqpqy image ministre education national jean michel blanquer pari aout
56,ordonne titre conservatoire huis clore total stade lens incident contre lille commission disciplin ligue football professionnel sanctionn club lens huis clore total stade titre conservatoire attente instruction grave incident survenir entre supporter lors derby lens lille samedi image bfmtv ijzfwn jnnq image ordonne titre conservatoire huis clore total stade lens aprer incident contre lille
57,emmanuel macron demande pardon harki france france manqu devoir envers harki leur femme leur enfant clar chef etat lors ception elys consacr moire harki combattre fran aise durant guerre image bfmtv nwsn dofgdncq image emmanuel macron elysee septembre
58,lai passer permettre conduire augmentation confinement confinement report passage permettre conduire accumul temps attente souvent multipli deux certain partement plus touch autre image bfmtv kccn xcag image delais passer permettre conduire augmentation apres confinement
59,proc nordahl lelander avocat alain jacubowicz faire tout roule dignement alain jacubowicz avocat nordahl lelandai taire dimanche invit bfmtvsd bfmtv interrog proc venir client assur faire tout roule dignement image bfmtv srrnc fxslvt image proce nordahl lelandai avocat alain jacubowicz faire tout deroule dignement
60,mobilisation contre racisme anti mitisme organis dimanche pari journ mobilisation contre racisme anti mitisme lieu dimanche pari organis plusieurs organisation antiraciste syndical france insoumise choisir joindre image bfmtv dclnnuuavfyomtjqhwww image mobilisation contre racisme antisemitism organisee dimanche pari
61,mallevill inconditionnel mort mallevill inconditionnel mort dimanche taire atteindre cancer cemment fici soutien club marseillais image bfmtv ewayx eqac phzhrqb rchoim image rene mallevill inconditionnel mourir
62,rixe entre biker faire mort tarbes samedi rixe entre biker faire mort deux bles tarbes samedi rassemblement regrouper environ personne chaque tenir ville durant salon bagarre entre plusieurs dizaine motard clat parking centre exposition coup couteau chang auteur coup couteau prendre fuite recherch image bfmtv rcrsiz hcnwashcbchrwjrj image rixe entre biker faire mort tarbes samedi
63,anti pass sanitaire personne manifest samedi selon rieur mobilisation marque personne dont pari samedi contre pass sanitaire selon compte minist rieur contre week dernier image bfmtv huwl fygrpwg image manifestation anti pass sanitaire nante septembre
64,automobiliste fonc terrasse fontainebleau seine marne blesser personne automobiliste fonc terrasse fontainebleau seine marne samedi bless personne maire ville valletoux expliqu conducteur sembler vacu vers urgence psychiatrique pital melun image bfmtv fahv purd czhbilsba image automobilist foncer terrasse fontainebleau seine marne blesser personne
65,chasse entre manifestant forcalquier alpe haut provence selon organisateur chasseur manifester samedi partout france forcalquier alpe haut provence taier entre mobilis selon organisateur image bfmtv mvhez jkmacv jrqsslldwta image chasse entre manifestant forcalquier alpe haut provence selon organisateur
66,manifestation anti pass sanitaire pari cort train disperser manifestation contre pass sanitaire lieu samedi partout france pari cort train disperser manifestant taient attendre capital image bfmtv lsged ytyojod azyzaofm image manifestation anti pass sanitaire pari cortege train disperser
67,pari funambule nathan paulin lanc depuis tour eiffel funambule nathan paulin lanc depuis tour eiffel samedi parcourir tre tres hauteur rallier chaillot image bfmtv jjdvw wmnkpfftnjo image pari funambule nathan paulin elance depuis tour eiffel
68,pari funambule nathan paulin appr lancer depuis tour eiffel travers tres hauteur funambule nathan paulin lancer depuis tour eiffel samedi parcourir tre tres hauteur rallier chaillot image bfmtv hwnxfbw hpkspimu bajpn image pari funambule nathan paulin apprete elancer depuis tour eiffel traverse metre hauteur
69,salle shoot pari riverain mobiliser samedi devant mairie arrondissement plusieurs centaine habitant pari manifester samedi devant mairie arrondissement protester contre installation lieu consommation drogu curi quelque minute chez image bfmtv vohajjetja lojq wujk image salle shoot pari riverain mobiliser samedi devant mairie arrondissement
70,dame pari curisation cath dral achev restauration pouvoir commencer curisation cath dral dame pari termin sormais tape restauration commencer plus deux incendie devoir marrer premier semestre objectif ouverture toujours maintenir image bfmtv hcrknv yhnnpphd rtpzc image dame pari securisation cathedral acheve restauration pouvoir commencer
71,manifestation contre pass sanitaire vue samedi france manifestation contre pass sanitaire vue samedi france entre personne attendre contre pass sanitaire tout france cort parisien gilet jaune sent image bfmtv xbnjipyggvxpyrkmibsu image manifestation contre pass sanitaire prevue samedi france
72,pari agac situation autour jardin habitant quitter quartier stalingrad pari habitant quartier stalingrad bout vacuation jardin eol rien arrang pont riquet campement environ consommateur crack progressivement install temps preuve sespoir cesse grandir quartier vide sident assure habitant image bfmtv rfomwyfifyo msupuzldvbdq image pari agace situation autour jardin eol habitants quitter quartier stalingrad
73,image rieur dame pari travail curisation travail curisation cath dral dame pari termin cath dral sormais sauv phase restauration reconstruction party truite incendie maintenant entam ouverture visite culte devoir avoir lieu image bfmtv erfvuyjzfxi npuu cuaoy image image interieur dame pari apre travail securisation
74,chasse interdire chasseur rassembl forcalquier alpe haut provence manifester chasseur manifester samedi cision conseil concerner technique chasse traditionnel oiseau cinq grand manifestation lieu plusieurs ville france mont marsan chasseur rassembl forcalquier alpe haut provence chasseur sent entendre interpeller christophe castaner sident groupe larem assembl national partement image bfmtv baotkh bzzdycu image chasse interdire pre chasseur rassemble forcalquier alpe haut provence manifester
75,guise centaine masque citoyen lutte contre chet fabriqu costume mesure afin alerter autorit population
76,nouveau projet torch deux champ trolier torchage consiste chappe lors processus extraction brut pratique polluant
77,champion mond taille erlander rapetisser plus grand monde combien temps selon tude publi vendredi ration erlander plus petit celle
78,island conner plus long ruption volcanique depuis plus dimanche cela faire mois ruption mont fagradalsfjall commenc million tres cube lav produit
79,coincer tenter mesurer adolescent subir ration urgence londre trang rience tourn
80,apple annoncer gamm iphon quatre iphon sentir leur leur batterie plus performant capacit devoir tendre plus rateur phonique pays gion
81,roseau plum ritabl biodiversit certain plante pouvoir causer ritable probl environnemental notamment roseau plum herb pampa class parmi pire invasif europe
82,athl quadri amput elon musk promettre emmener espace hello elonmusk aventurier fran sans bras jambe tweet sportif intention patron tesla space
83,entreprise ricain vouloir recr mammouth laineux entreprise colossal donne objectif hybride faire agir quence mammouth laineux collect restes serv rien nom phant asi
84,universit voile addiction coca tude unige permettre identifier rotonine lors prendre cocer savoir ainsi pourquoi addiction ce drogue concerne consommateur
85,space lancer tour premi mission tourisme spatial mercredi quatre passager novice passer trois jour espac premi mission histoire sans aucun astronaute professionnel
86,tour horizon obligation vaccinal monde certificat vaccination certains gorie impos nombre croissant pays plan
87,vaccin infection naturel quilibre trouver face varier delta sormais admettre efficacit vaccin diminue contre contamination bien reste indispensable
88,motion viser prot amazonie approuv union international conservation nature notamment adopt motion protection amazonien
89,grand dauphin sous troite surveillance diterran clas vuln rabl uicn grand dauphin tudi biologiste diterran objectif mieux conner mieux prot
90,vaccino scepticism toujours exist vaccination longtemps suscit controverse pass fruit apprenti sorcier aujourd certains comme instrument cryptage
91,qualit bureau affecte capacit cognitif scientifique harvard montr mauvais ration bureal provoque perte capacit cognitif
92,pouvoir faire retour bien plus produire tout deux sept consid comme termin juin chauffement climatique pouvoir revenir
93,nouveau coinventeur vaccin messager sormai projet immunologu vaccin contre tout coronavirus selon choix entre attendre prochain passer demi
94,pari jeff bezos ralentir vieillissement homme plus riche monde investisseur start alto labs dont travailler vieillissement cellule humain
95,redonner couleur tigre tasmani national film sound archive australia venir faire coloriser film seconde dater montrer tout dernier cimen tigre tasmanie connaître aujourd teinte depuis
96,salins faire sauter digue laisser faire vieux salin derni zone humide entre camargue italie faire sauter rocher artificiel choisir laisser faire plage redessin tout cosyst
97,nasa confirme rover premier chantillon roche mission mars engin perseveranc nasa bien prendre morceau roche stocker agence spatial ricain licit lundi
98,vole deux tunnel cascadeur italien dario costa alis exploit samedi dernier commande zivko edge devenir premier homme avoir pilot avion rieur tunnel atteindre vitesse record lieu istanbul turquie homme ensuite ussite faire looping degr
99,travers ciel ouest france scientifique confirmer bolide travers ciel ouest france angleterre faire jour quelque seconde
100,rencontre homm mesure fonte glaciers directeur glacier monitoring switzerland matthia huss mesure inexorablement diminution paisseur glaciers alpe coeur passionn fascinant scientifique
