,0
213,tourisme spatial persuad voir prix baisser assure patrick baudry premier touristique espacer achev succ samedi soir quipag compos quatre astronaute professionnel premi histoire amerrir large florid avoir pass trois jour espace europe deuxi astronaute fran espace patrick baudry salue ce prouesse
214,quatre passager space retour terre trois jour espace quatre premier touriste spatial space amerrir samedi soir atlantique large florid avoir pass trois jour espace retour terre venir couronner succ premi mission orbital histoire comport aucun astronaute professionnel bord
215,proc attentat novembre victime besoin comprendre entendre samia maktouf avocat party civil proc attentat novembre parle importance proc historique victime comportement quot quot salah abdeslam taire invit jean pierre elkabbach europe cnews
216,info europe couvrir courrier darmanin envoy maison dition nawa ministre rieur rald darmanin nbsp annonc vendredi intention dissoudre maison dition nawa quot centre tude oriental traduction quot publier diffuse plusieurs ouvrage faire promotion jihad europe argument minist proc ce dissolution
217,covid vers gement restriction sanitaire gouvernement ministre sant olivier voqu nouveau piste quot fran pouvoir respirer plus possible quot interview quot parisien quot alors semble reculer parmi lui pass sanitaire certain endroit europe decin infectiologu benjamin davidot appeler prudence
218,chanteur imany meilleur repas quand tourn voil voix faire bien deux dernier album ailleurs coul plus million exemplaire occasion sortir dernier album quot voodoo cello quot chanteur nbsp imany partag confidence culinaire tait invit laurent mariotte mission quot table bon vivant quot europe
219,comment cuisiner bon pissaladi comme nice chaque samedi quot table bon vivant quot laurent mariotte chroniqueur invit livrer leur meilleur recette ce semaine couvrez recette pissaladi thomas dufour chef restaurer bauchoir pari
220,immobilier encadrement loyer devoir mentionn annonce annonce immobili location logement soumettre encadrement loyer devoir faire mention indiqu samedi ministre logement emmanuell wargon gouvernement vouloir faire face part important annonce respecter
221,pourquoi morue star cuisine portugais comment cuisiner simple reus cuisine portugais quoi titiller papille produit embl matiqu pays morue ce semaine mission laurent mariotte quot table bon vivant quot couvrir plat phare portugal nbsp
222,voici thode ancestral colter licieux coco paimpol ingr dient embl matique gastronomie breton coco paimpol alors saison haricot particulier termine octobre europe invite couvrir comment produit colt main depuis mission laurent mariotte quot table bon vivant quot europe rendre bretagne couvrir ce thode ancestral nbsp
223,video stealthing act dangereux bier californi pendant temps retirer furtivement servatif pendant rapport sexuel bier californie ce pratique stealthing
224,deliveroo trois ancien dirigeant renvoy devant tribunal correctionnel pari travail dissimul parquet pari ouvert enqu liminaire confi office central lutte contre travail oclti
225,lutte contre minicider espagne pouvoir appeler agent protecteur importe quel moment plus seul alors france nombre minicide peine baisser significativement espagne poursuivre politique volontariste duction violence faire femme minicide choir depuis
226,etat unis voir accueillir fugi deux fois plus sident ricain nbsp biden nbsp tenir ainsi nbsp promesse campagne doubler chiffre fiscal commencer octobre
227,toulouse garde prolong compagnon femme retrouv mort mirail deux autre personne plac garde principal suspect ce affaire devoir sentir juge mardi
228,video portrait philippe croizon aventurier fran premier handicap partir espace elon musk aventurier philippe croizon amput quatre membre travers manche sept plus tard particip pari dakar crit elon musk milliardaire ricain patron space demander envoyer espace ponse nbsp nbsp extraire magazine samedi
229,rentr quel diff rente strat gie anti covid classe covid gress france lieu concentre encore tout inqui tude cole enfant vaccin
230,video affaire sensible sidentielle quand conseil constitutionnel valide imagination habilet compte campagne gulier jacques chirac ouverture archive conseil constitutionnel replac actualit vingt cinq plus tard campagne sidentielle lant scandale etat document voir nbsp septembre france nbsp affaire sensible nouveau magazine coproduire france vision france inter mission original france inter plong archive exhum facture note frais biff sage extraire voici comment compte gulier valid
231,tudiant enfin retour petit boulot difficile horizon semble enfin gager tudiant retour sentiel universit aussi job appoint afin financer leur tude nbsp nbsp
232,cole petit jeuner gratuit tendre zone rural plus plus commune proposer petit jeuner gratuit cole dispositif financ nbsp duire galit social nbsp
233,question soci grand marseille servir boosteur classe politique etat devoir encore plus prendre main habitu dimanche franceinfo accueillir aussi maintenant samedi sociologue jean viard directeur recherche cnrs auteur diteur tout ce saison aller essayer pondre question soci soulev actualit
234,question soci attentat septembre marqueur historique pouvoir aussi position tat unis monde rendez question soci aujourd samedi septembre consacr anniversaire attentat septembre moire clairage sociologu jean viard
235,recit assaut kilimandjaro fran atteindre rose plaque julien dani nbsp ter ascension toit afriqu projet nbsp trentenaire marche difficult souffrir vertiges
236,rentr universitaire face carit emma propose tarif encore plus solidaire tudiant selon fage principal syndicat tudiant clar dernier avoir connaître difficult financi nbsp cours trois dernier mois
237,video climat empreindre carbone chaque plat menu wagon restaurer train gentil nuit devoir train nuit sembler disparer redevenir actualit face urgence climatique moyen transport plus doux avion remettre rail table passager inform impact environnement coup fourchette extraire magazine europ diffus dimanche septembre france
238,video collaboration entre patron cross marine national porter secours migrant large caler zone patron saint catherine labour trouve ligne caler douvre nbsp migrant emprunter tout jour rendre angleterr jour nbsp main fort ration sauvetag extraire magazine dimanche nbsp septembre
239,environnement allemagn investir massivement nergie renouvelable mandat angela merkel allemand retenir ration transition nerg tiqu pays catastrophe fukushima japon allemagne bouch double construire olienner parc solaire
240,consommation drogue france amende forfaitaire lictuelle mettre place dispositif indiquer consommateur drogu recevoir amende euro inscription casier judiciaire temps faire point dispositif vraiment efficace nbsp
241,marque bordeau chesnel devoir adapter consommateur saga entreprise agroalimentaire fran aise marque charcutier sarthois cialiste rillette bordeau chesnel nbsp pierre bert directeur bordeau chesnel invit olivier lagarde nbsp
242,temps calme temps assez ensoleill annoncer mardi institut royal orologique
243,photo floriffoux pompag tang protection civil wash niche deux mois intemp rie noue bordante intervention protection civil
244,infographie prof bien simpliste donn publi ocd indiquer salaire enseignant rieur moyenne constat nuancer cryptage
245,jean marc gravir mont blanc falloir avoir deux fils toucher lancer genre truc vendredi immense jean marc bernardo habitant fontaine entame derni ligne droite parvenir faire ascension mont blanc bon cause celui objectif colter moins
246,port masqu walloni jeudi semaine prochain gouvernement wallon devoir prononcer ventuel gement port masqu jeudi semaine suivant indiqu ministre sident wallon elio rupo lundi commission parlement wallon
247,cret wallon assur assur milliard accord trouv couvrir sinistr assur aussi assur faire objet projet cret lundi commission
248,covid diatre demander suppression mesure moins ce cision comporte risque favoriser normalisation enseignement jeune selon organisation
249,photo lieu balade citoyen amorcer changement tamine soci alphavill sentir samedi premi ligne revitalisation tamine lieu privil duire voiture augmenter espace public
250,carolo vitesse abords cole police local charleroi annonc ration vention autour cole semaine rentr voici sultat
251,suite quitt charleroi adieu solennel sence communaut quitt charleroi adieu solennel lieu dimanche
252,projet durable europe devoir revoir copie suffisamment stimul investissement durable estime cour compte europ enn rendre rapport moins mitig
253,brief jour effondrement grue ruption canarie emploi menac chez liberty steel grue effondr forest ruption forc vacuation personne canarie liberty steel vouloir parer travailleur voici faire actualit lundi
254,vendre quoi faire jeune info accuse perte conduire principal actionnaire mettre vente
255,inondation million paration route pont voie hydraulique gouvernement wallon accord lundi enveloppe million paration route ouvrage voie hydraulique gionale endommag inondation mois juillet
256,vaccimobil depuis lundi vaccination venir province luxembourg lundi buter marloi tellin campagne vaccimobil province luxembourg semaine permettre celui encore faire vacciner
257,crise sous marin australien gociation moment choisir annoncer partenariat aukus quelque semaine prochain climat pouvoir briser espoir accord mission chinois
258,tout attentat septembre explosion terroris toulouse vendredi septembre quelque tonne nitrate ammonium subitement explos toulouse agir plus grand catastrophe industriel france depuis
259,pardon macron harki manque encore reconnaissance coeur sident public demand pardon harki lundi pari ouvert voie promulgation paration ce communaut meurtrir important juge historien jean jacques jordi
260,vers prolongation passer sanitaire auckland encore confin point pand gouvernement fran proposer octobre viser proroger syst parfois passer sanitaire novembre
261,fiance manqu moyen guadeloup impossible vaccination soignant guadeloupe plus agent vaccin suspension inenvisageable explication
262,lelivrescolair manuel scolaire flirte pens wok lelivrescolair conner succ croissant monde enseigner ce maison dition marque notamment ligne ditorial parfois trop militant
263,proc novembre horreur frappe barre proc historique attentat novembre ouvert septembre dernier huit premier jour particuli rement prouver notamment lors position enqu teur
264,biodiversit climat quoi ressembler monde chauffement selon conclusion rapport giec repris engagement tat signataire accord pari poursuivre rythme monde vers chauffement catastroph
265,alexandre gady falloir prot patrimoine beaut muet vacarme contemporain patrimoine selon historien alexandre gady victime empressement gligence collectif sidentielle occasion rappeler
266,covid conseil scientifique demande plus pistage cole pistage covid devoir syst matiqu hebdomadaire cole primaire seul enfant positif renvoy chez
267,abnousse shalmani autodaf tintin riqu claration guerre woke quand chasse dire repr sentir consiste livre prohiber civilisation agir chroniqueus nouveau venue ontario ouvrage censur
268,passer sanitaire besoin politique agile contre covid directeur institut sant global universit antoine flahault rappeler difficile voir volution plus sept jour
269,restaurer dame identique comment puriste veiller grain incendie cath dral emmanuel macron envisag possibilit quot geste architectural contemporain quot avant annoncer restaurer identique
270,bern tire bilan sauv monument culture combien quot oreille sident tout temps quot entendre patrimoine moins olien derni croisade derni partie enqu
271,ligne faire pirate donn dicale donn personnel environ million personne pist contre covid attaque informatique faire quoi
272,christian gollier enfin vrai prix carbone depuis prix mission multipli deux bon nouveau climat dynamique teindre
273,record investissement massif chiffre emmanuel macron rendre gare lyon pari vendredi brer ligne grand vitesse
274,jean laurent cassely individualism caus crise soci plusieurs essai pencher tamorphose question primordial rapport entre individu collectif
275,gilet jaune ruralit bern royaliste devenir idole france sesp entre narquer france populaire animateur choisir camp quot patrimoine question identit quot confier express suite enqu
276,chasse traditionnel quand emmanuel macron braconne droite cision conseil etat juger plusieurs technique chasse traditionnel oiseal gale gouvernement mercredi plusieurs consultation autoriser certain
277,lionel shriver pouvoir cher sentir blanc culte fitnes appropriation culturel discrimination positif grand romanci ricain pingle vrose contemporain
278,macron face daill patrick kanner appeler montrer doigt sportif ancien ministre sport estime devoir massivement investir souhaite voir athl olympique exceller
279,comble che permanence travail sarroi manager entre pression rarchie attent salari adaptation mode travail quot hybride quot certain manager faire part licate position moignage
280,pitau pari trois question massif donn test covid donn personnel environ million personne effectu test pistage covid france
281,salaire enseignant pourquoi pouvoir comparer allemagne bernard toulemonde ancien recteur directeur comparer salaire entre enseignant fran allemand sans comparer aussi obligation servic faux tout
282,macron bataille secr ennemi vrai histoire phane bern connaître animateur amateur couronn couvrir murmurer oreille macron porte voix france populaire enqu influence
283,lagard perquisitionn reproch groupe affaire amber capital mercredi perquisition lieu parisien groupe dirig arnaud lagard accus quot achat vote quot encore abus bien social quot
284,covid comment gouvernement pare fermeture centre vaccination centre vaccination contre covid pouvoir baisser rideau mois vrier prochain pharmacien decin ral prendre relais
285,plus ruiner paysage patrimoin fracture fran aiser parce touche zone sensible identit commune patrimoine toujours sujet inflammable derni querelle changent corser
286,dossier express patrimoine nouveau querelle patrimoine reste france sujet inflammable terrain infini bataille entre ancien modernes autour futur dame atteste homme incarne ce passion fran aise phane bern temps quinquennat fort proximit couple macron animateur amateur couronn devenir quot incontournable patrimoine quot ador france rural sentir laiss combat contre oliennes dragu politique tout bord influence express vouloir valuer
287,entre super nurie obligation vaccinal ehpad redouter sous effectif manqu flagrant soignant certain structure craindre plus pouvoir apporter soin cessaire bien leur sident
288,revenu condamnation hanouna enqu fabrice vizio avocat anti passer sanitaire cort anti passer sanitaire didier raoult covid faire avocat star controver venir annoncer rupture hanouna portrer
289,vaccination obligatoire risquer vraiment soignant calcitrant compter mercredi soignant vaccin contre covid risquer suspension pur simple contrat travail
290,tude montre facebook conner effet faste instagram jeune fille depuis entreprise arriv conclusion application photo nuire fortement image jeune fille lui
291,covid donn plaider faveur troisi dose tout selon auteur tude efficacit vaccin contre forme grave covid reste suffisamment instant troisi dose donc adapt population ral quot stade pand quot
292,beauvau curit falloir retenir annonce emmanuel macron emmanuel macron annonc mardi devant policier gendarme repr sentant syndical diff rente cision prendre cadr beauvau curit
293,beauvau curit comment voisin europ contr lent leur policier mardi emmanuel macron annonc mettre place instance contr parlementaire force ordre chez voisin europ
294,plus grand plus fragile bon sant tromp oeil fran aise surface foresti fran aise gagn plus million hectare bon nouveau cache pourtant cosyst menac surexploitation changement climatique
295,covid efficacit vaccin janssen mettre doute taux anormalement patient vaccin janssen admettre pital laboratoir johnson johnson faire objet investigation suppl mentaire
296,changement climatique pouvoir pousser million personne migrer lundi expert banque mondial avancer rapport quot urgent agir quot viter plus plus quot migrant climatique quot
297,petit jeuner cole trois plan pauvret cutif peine tenir promesse ce mesure inscrire plan pauvret gouvernement concerner enfant grigny reste territoir ploiement dispositif
298,vaccin pourquoi royaum sili contrat million dose valneva million dose vaccin laboratoir franco autrichien devoir livr prochain royaume gouvernement retir brusquement cryptage
299,pierre abadi financ pouvoir sauver climat orier vers secteur carbonant investissement priv pargne mondial essentiel atteindre objectif climatique
300,affaire benalla trois autre venir comparaître trois retentir scandale secou elys alexandre benaller partir lundi pari vincent crase deux fonctionnaire fecture police pari
301,falloir savoir ligue fense noir africain souhaite dissoudre darmanin ministre rieur justifi ce cision suite incident survenir commun reuil savoir ce organisation contest
302,payer triomphe emball enqu business monumental contemporain trente cinq pont neuf tour triomphe empaquet nouveau entr contemporain espace public autofinanc christo
303,ecriture inclusif lettre ouvert julien bayou collectif linguiste bondir propos secr taire national europe ecologie vert cent entretien express vanter criture inclusif pondre lettre ouvert
304,classe ferm france sillusion valneva point pand gouvernement britannique annonc siliation contrat laboratoir franco autrichien porter million dose candidat vaccin
305,soignant ambulancier combien vaccin manquer appel mercredi quelque million professionnel travailler tiers soin concern entr vigueur mercredi obligation vaccinal celui toujours moindre dose exposer suspension
306,comment utilisation drone force ordre refaire discr tement surfacer article usage drone force ordre autrefois censur apparer amend nouveau projet curit rieure examin partir mardi assembl national
307,pari bruxelle ville transition circulaire organis seau bruxellois circlemade brussel partenariat inec occasion changer autour production urbain circuit court aussi logistique inverse mobilit doux upcycling programm accueil introduction ral isabelle grippa directrice ral brussel quell importance accord conomie circulaire chelle
308,tude dire conomie circulaire cosyst biodiversit vers approche conjoint occasion congr mondial nature marseille butant aujourd institut national conomie circulaire inec publier nouveau tude economie circulaire ecosyst biodiversit vers approche conjoint transition vers conomie circulaire naturellement pair protection cosyst servation ressource richesse sol protection
309,grer conomie circulaire chantier premi source chet france acteur secteur organiser faire chet ressource potentiel marge progression reste possible certain fili application principe conomie circulaire emploi utilisation gration matir recycl autant
310,publication tude pivoter vers industrie circulaire quel comment quel conomique circulaire quel frein adoption circularit industriel quel levier entreprise industriel circulaire lui activ inec opeo cabinet conseil transformation industriel associ aliser ce tude industrie circulaire durant voici produire
311,rapport activit inec 
312,labellisation economie circulaire cerema cerema pilote nouveau marche labellisation chell national domaine conomie circulaire projet objectif mettre lumi projet grent enjeu conomie circulaire label permettre mont comp tence ensembl acteur matir vention gestion chet issu
313,labellisation conomie circulaire ademe ademe disposition territoire ress conomie circulaire rentiel permettre aliser autonomie lieu rapide transverse politique territorial conomie circulaire utilisation rentiel permettre identifier action engager davantage renforcer plan action politique conomie circulaire ainsi
314,webinar mieux dire service conomie circulaire faire poids conomiqu fran commande public constitue levier majeur transition cologiqu exemplarit pouvoir public volume affaire engag impacter directement offrir conomiqu pratique fournisseur cente forme commande public france europe offrir
315,responsabilit largi producteur saco quel changement economie circulaire inec publier nouveau publication saco responsabilit largi producteur agec charger publication occasion cent publication cret porter forme responsabilit largi producteur parer pertinent revenir principe fonctionnement responsabilit largi producteur
316,cryptage strat vague novation europe commission europ enn commission europ enn publi strat vague novation renovation wave strategy annonc pacte vert europ destin liorer performance nerg tiqu timent commission entendre moins doubler taux novation cours prochain million timent pouvoir jusqu
317,focus collectivite territorial economie circulaire favoriser transition territoire vers conomie circulaire charger publication exacerb contexte crise sanitaire prise conscience collectif cessit transiter vers conomie plus silient inclusif circulaire depuis plusieurs pratique conomie circulaire multiplier territoire ce tendance vocation
318,webinaire responsabilit largi producteur saco novembre dernier cret venir former gime responsabilit largi producteur inscrire responsabilit largi producteur historiquement velopp france anmoins syst complexe financement produit trop connaître grand public
319,community management entreprise mature party hypoth analyse conclusion tude qualitatif orie permettre mieux comprendre processus communication entre diff rent ment situation quelconque donc important finir probl matiqu ensuite senter hypoth soudre comprendre probl partir concept
320,march cosm tique ligne avis consommateur sein celui chapitre moir march cosm tique satur concurrence roce cela vrai tout niveau niveau qualit prix marque cost marque premium jamais autant marque affront secteur cosm tiqu bien obtenir
321,comment bugatti prendre compte attente client bugatti constructeur automobile fran apparaître cialis voiture sport luxe marque faire prouesse technologique pouvoir observer chez hicule confirmer succ voiture comptabiliser plus
322,saas software service march cosm tique software service saas pouvoir traduire fran logiciels sous forme service ce notion coule autre appel cloud computing informatique nuage concept saas apparaître vers saas peser plus milliard euro
323,comment bugatti prendre compte nouveau technologie processu ation innovation technique design remarquable vitesse caract ristique bugatti facteur faire voiture oiver conserver valeur riode difficile comment bugatti prendre compte nouveau technologie processu
324,transformation digital rateur communication revue litt rature moir analyser transformation digital finir tout abord concept ainsi enjeu associ puis resser changement comportement client analyser galement digitalisation
325,probl matiqu rencontr strat gie mettre place ancrage durable march belge tude secteur gardiennage organe important tissu conomie mondial conomie belge particulier organe repr sentent entreprise belge plus entreprise couvrir tout type activit march belge chaque entreprise pouvoir employer
326,inclusion bancaire permettre lier relation commercial client partie moir banque fran aise voir divers moyen prot particulier agir leur besoin personnel ainsi soutenir inclusion bancaire banque devoir alors proposer leur client fragile financi rement offrir cifiqu service moyen paiement
327,image bugatti compatible valeur environnemental bugatti fabricant voiture fran aiser rachet groupe allemand volkswagen depuis fondateur italien ettore bugatti lanc soci ce marque luxe france acquérir putation hors pair cependant position
328,inclusion bancaire permettre lier relation commercial client partie moir notion inclusion bancaire renvoyer capacit particulier avoir usage service bancaire existant ailleurs galement aspect ventif surendettement ce notion apparaître suite paration gulation
329,brand culture influence marque employeur alisation tude qualitatif laboration questionnair cadr entretien individuel document questionnair adresser participant lors entretien individuel inscrire cadre tude qualitatif brand culture comment celui influence marque employeur
330,tant outil gestion efficace patrimoine cadr accompagnement expert comptable proposition plan moir travail recherche tenter mettre vidence devoir constituer outil basique fondamental gestion patrimoine cessite accompagnement expert
331,difficult ussite insertion professionnel jeune quartier prioritaire politique ville comment etat association allier atteindre galit chance plan moir introduction devoir contenir ralit contexte recherche justification choix sujet recherche motivation social scientifique identification formulation probl question recherch clair cise aliste
332,quoi volution actuel march musique classique transform mode consommation france industrie mondial musique connaître long riode tude expansion pendant plus quart environ milliard disque vendre monde nombre plus tripl directeur
333,faire levier innovation entreprendre responsabilit soci tal entreprise finir commission europ enn comme concept signe gration volontaire entreprise occupation social environnemental leur activit commercial leur relation leur party prenant
334,comment entreprise pouvoir faire pivoter business model face innovation technologique exemple oracle transformation licence vers cloud heure actuel compte tenir perspective situation conomiqu mondial changement technologique lieu derni devenir cessit indispensable entreprise adopter strat gie innovant garantir survivre
335,comment olympique lyonnais devenir ritabl marque commercial jour depuis cinquante football occupe place important coeur individu alors taire consid comme divertissement chang rang exploit comme ritabl business ainsi club amateur devenir professionnel
